{
  "contract": "proposal-0012-candidate-2",
  "root": {
    "key": {
      "scope": "local",
      "id": "root",
      "version": "1"
    },
    "kind": "System"
  },
  "definitions": [
    {
      "key": {
        "scope": "local",
        "id": "agent",
        "version": "1"
      },
      "kind": "Agent",
      "owner": {
        "scope": "local",
        "id": "root",
        "version": "1"
      },
      "payload": {}
    },
    {
      "key": {
        "scope": "local",
        "id": "principal",
        "version": "1"
      },
      "kind": "Principal",
      "owner": {
        "scope": "local",
        "id": "root",
        "version": "1"
      },
      "payload": {}
    },
    {
      "key": {
        "scope": "local",
        "id": "interface",
        "version": "1"
      },
      "kind": "Interface",
      "owner": {
        "scope": "local",
        "id": "root",
        "version": "1"
      },
      "payload": {
        "inputs": {
          "x": "string"
        },
        "outputs": {
          "y": "string"
        },
        "action": {
          "scope": "local",
          "id": "action",
          "version": "1"
        }
      }
    },
    {
      "key": {
        "scope": "local",
        "id": "direction",
        "version": "1"
      },
      "kind": "Instructions",
      "owner": {
        "scope": "local",
        "id": "root",
        "version": "1"
      },
      "payload": {}
    },
    {
      "key": {
        "scope": "local",
        "id": "flow",
        "version": "1"
      },
      "kind": "ControlFlow",
      "owner": {
        "scope": "local",
        "id": "root",
        "version": "1"
      },
      "payload": {}
    },
    {
      "key": {
        "scope": "local",
        "id": "action",
        "version": "1"
      },
      "kind": "Action",
      "owner": {
        "scope": "local",
        "id": "root",
        "version": "1"
      },
      "payload": {}
    },
    {
      "key": {
        "scope": "local",
        "id": "resource",
        "version": "1"
      },
      "kind": "Resource",
      "owner": {
        "scope": "local",
        "id": "root",
        "version": "1"
      },
      "payload": {}
    },
    {
      "key": {
        "scope": "local",
        "id": "approval",
        "version": "1"
      },
      "kind": "ApprovalRequirement",
      "owner": {
        "scope": "local",
        "id": "root",
        "version": "1"
      },
      "payload": {
        "approvers": [
          {
            "scope": "local",
            "id": "principal",
            "version": "1"
          }
        ],
        "validForMs": 100
      }
    }
  ],
  "relations": [
    {
      "source": {
        "scope": "local",
        "id": "agent",
        "version": "1"
      },
      "relation": "actsAs",
      "target": {
        "scope": "local",
        "id": "principal",
        "version": "1"
      },
      "expectedKind": "Principal"
    },
    {
      "source": {
        "scope": "local",
        "id": "agent",
        "version": "1"
      },
      "relation": "exposes",
      "target": {
        "scope": "local",
        "id": "interface",
        "version": "1"
      },
      "expectedKind": "Interface"
    },
    {
      "source": {
        "scope": "local",
        "id": "agent",
        "version": "1"
      },
      "relation": "directedBy",
      "target": {
        "scope": "local",
        "id": "direction",
        "version": "1"
      },
      "expectedKind": "Instructions"
    }
  ],
  "exports": [],
  "dependencies": [],
  "unresolved": [],
  "extensions": [],
  "graphs": [
    {
      "definition": {
        "scope": "local",
        "id": "flow",
        "version": "1"
      },
      "entry": "gate",
      "inputs": {
        "x": "string",
        "context": "json",
        "flag": "boolean"
      },
      "outputs": {
        "y": "string"
      },
      "steps": [
        {
          "id": "gate",
          "kind": "approval",
          "requirement": {
            "scope": "local",
            "id": "approval",
            "version": "1"
          },
          "timeoutMs": 50,
          "approved": "call",
          "denied": "call",
          "failure": "bad"
        },
        {
          "id": "call",
          "kind": "invoke",
          "agent": {
            "scope": "local",
            "id": "agent",
            "version": "1"
          },
          "interface": {
            "scope": "local",
            "id": "interface",
            "version": "1"
          },
          "action": {
            "scope": "local",
            "id": "action",
            "version": "1"
          },
          "resources": [
            {
              "scope": "local",
              "id": "resource",
              "version": "1"
            }
          ],
          "principal": {
            "scope": "local",
            "id": "principal",
            "version": "1"
          },
          "context": {
            "input": "context"
          },
          "inputs": {
            "x": "string"
          },
          "outputs": {
            "y": "string"
          },
          "bindings": {
            "x": {
              "input": "x"
            }
          },
          "success": "ok",
          "failure": "bad"
        },
        {
          "id": "ok",
          "kind": "end",
          "outcome": "success",
          "bindings": {
            "y": {
              "step": "call",
              "port": "y"
            }
          }
        },
        {
          "id": "bad",
          "kind": "end",
          "outcome": "failure",
          "reason": "failed"
        }
      ]
    }
  ]
}
