{
  "contract": "proposal-0012-candidate-2",
  "root": {
    "key": {
      "scope": "local",
      "id": "root",
      "version": "1"
    },
    "kind": "System"
  },
  "definitions": [],
  "relations": [],
  "exports": [],
  "dependencies": [
    {
      "id": "dep",
      "rootKey": {
        "scope": "annex",
        "id": "root",
        "version": "1"
      },
      "status": "external",
      "requiredFor": [],
      "sha256": null
    }
  ],
  "unresolved": [],
  "extensions": []
}
