{
  "contract": "proposal-0012-candidate-2",
  "root": {
    "key": {
      "scope": "local",
      "id": "root",
      "version": "1"
    },
    "kind": "System"
  },
  "definitions": [
    {
      "key": {
        "scope": "local",
        "id": "agent",
        "version": "1"
      },
      "kind": "Agent",
      "owner": {
        "scope": "local",
        "id": "root",
        "version": "1"
      },
      "payload": {}
    },
    {
      "key": {
        "scope": "local",
        "id": "principal",
        "version": "1"
      },
      "kind": "Principal",
      "owner": {
        "scope": "local",
        "id": "root",
        "version": "1"
      },
      "payload": {}
    },
    {
      "key": {
        "scope": "local",
        "id": "interface",
        "version": "1"
      },
      "kind": "Interface",
      "owner": {
        "scope": "local",
        "id": "root",
        "version": "1"
      },
      "payload": {}
    },
    {
      "key": {
        "scope": "local",
        "id": "direction",
        "version": "1"
      },
      "kind": "Instructions",
      "owner": {
        "scope": "local",
        "id": "root",
        "version": "1"
      },
      "payload": {}
    }
  ],
  "relations": [
    {
      "source": {
        "scope": "local",
        "id": "agent",
        "version": "1"
      },
      "relation": "actsAs",
      "target": {
        "scope": "local",
        "id": "principal",
        "version": "1"
      },
      "expectedKind": "Principal"
    },
    {
      "source": {
        "scope": "local",
        "id": "agent",
        "version": "1"
      },
      "relation": "exposes",
      "target": {
        "scope": "local",
        "id": "interface",
        "version": "1"
      },
      "expectedKind": "Interface"
    },
    {
      "source": {
        "scope": "local",
        "id": "agent",
        "version": "1"
      },
      "relation": "directedBy",
      "target": {
        "scope": "local",
        "id": "direction",
        "version": "1"
      },
      "expectedKind": "Instructions"
    }
  ],
  "exports": [],
  "dependencies": [],
  "unresolved": [],
  "extensions": [],
  "annotations": {
    "é": "é",
    "emoji": "😀",
    "__proto__": {
      "x": 1
    }
  }
}
