{
  "contract": "proposal-0012-candidate-2",
  "root": {
    "key": {
      "scope": "local",
      "id": "root",
      "version": "1"
    },
    "kind": "System"
  },
  "definitions": [
    {
      "key": {
        "scope": "local",
        "id": "subject",
        "version": "1"
      },
      "kind": "Resource",
      "owner": {
        "scope": "local",
        "id": "root",
        "version": "1"
      },
      "payload": {}
    }
  ],
  "relations": [],
  "exports": [],
  "dependencies": [],
  "unresolved": [],
  "extensions": [],
  "runtime": {
    "requirements": []
  }
}
