{
  "contract": "proposal-0012-candidate-2",
  "root": {
    "key": {
      "scope": "local",
      "id": "root",
      "version": "1"
    },
    "kind": "System"
  },
  "definitions": [],
  "relations": [],
  "exports": [],
  "dependencies": [],
  "unresolved": [],
  "extensions": [
    {
      "identity": "custom/feature",
      "version": "1",
      "operations": {
        "validateD": {
          "ignoreRule": "annotation-only"
        }
      },
      "payload": {
        "any": true
      }
    }
  ]
}
